{
  "schemaVersion": "0.1.0",
  "matrixVersion": "0.1.0",
  "normativeSources": {
    "document": {
      "lockId": "sysml-2.0-transformation-specification",
      "omgFileId": "formal/26-03-03",
      "sha256": "64366027dfef1ab630f741884695a68471939fcf68c3c7d874790d2c86ea518c"
    },
    "machineModel": {
      "lockId": "sysml-2.0-v1-to-v2-transformation-model",
      "omgFileId": "ptc/25-04-10",
      "sha256": "093359439fb62cb3a9b1e89fd850ac4ac0b4bbe135b4b54f7861492722cc8459"
    }
  },
  "rows": [
    {
      "id": "profile",
      "sourceConstruct": "UML Profile",
      "corpusCount": 9,
      "officialTarget": "Package",
      "officialClauses": [
        "7.7.9.3.21"
      ],
      "machineRuleIds": [
        "Mappings-UML4SysML-Packages-Profile_Mapping"
      ],
      "classification": "supplement",
      "proposalRule": "Reuse Package and retain the profile identity, URI, comments, and namespace-prefix facts.",
      "rationale": "The official target is suitable, but it does not retain every source fact required by the reverse contract.",
      "testObligations": [
        "The generated Package passes the pinned v2 validator.",
        "The reverse mapper restores the Profile rather than an ordinary Package."
      ]
    },
    {
      "id": "package",
      "sourceConstruct": "UML Package",
      "corpusCount": 15,
      "officialTarget": "Package with URI metadata when present",
      "officialClauses": [
        "7.7.9.3.11",
        "7.7.9.3.13-20"
      ],
      "machineRuleIds": [
        "Mappings-UML4SysML-Packages-Package_Mapping",
        "Mappings-UML4SysML-Packages-PackageURIMetadataUsage_Mapping"
      ],
      "classification": "supplement",
      "proposalRule": "Reuse Package nesting and URI metadata and retain exact source identity and presence.",
      "rationale": "The official rule supplies the semantic target; the manifest supplies reverse-reconstruction details.",
      "testObligations": [
        "Nested package paths and URI presence survive the round trip."
      ]
    },
    {
      "id": "package-import",
      "sourceConstruct": "UML PackageImport",
      "corpusCount": 9,
      "officialTarget": "NamespaceImport",
      "officialClauses": [
        "7.7.9.3.12"
      ],
      "machineRuleIds": [
        "Mappings-UML4SysML-Packages-PackageImport_Mapping"
      ],
      "classification": "supplement",
      "proposalRule": "Reuse NamespaceImport and retain source-form and target identity.",
      "rationale": "Exact href versus local-reference form is part of the preservation contract but not the semantic target.",
      "testObligations": [
        "Every imported target resolves offline.",
        "The reverse mapper restores the recorded reference form."
      ]
    },
    {
      "id": "metamodel-reference",
      "sourceConstruct": "UML MetamodelReference",
      "corpusCount": 9,
      "officialTarget": "Underlying PackageImport behavior",
      "officialClauses": [
        "7.7.9.3.12"
      ],
      "machineRuleIds": [
        "Mappings-UML4SysML-Packages-PackageImport_Mapping"
      ],
      "classification": "supplement",
      "proposalRule": "Reuse NamespaceImport for the underlying PackageImport and retain an explicit MetamodelReference discriminator in the preservation manifest.",
      "rationale": "The official transformation has no MetamodelReference-specific rule. Its PackageImport rule preserves the import but not the distinction introduced by the applied StandardProfileL2 stereotype.",
      "testObligations": [
        "All nine MetamodelReferences reconstruct as MetamodelReferences rather than ordinary PackageImports.",
        "Removing the manifest discriminator causes the round-trip comparison to fail."
      ]
    },
    {
      "id": "profile-application",
      "sourceConstruct": "UML ProfileApplication",
      "corpusCount": 8,
      "officialTarget": "Not mapped",
      "officialClauses": [
        "7.7.9.1 Table 12",
        "7.7.9.2 Table 13"
      ],
      "machineRuleIds": [],
      "classification": "supplement",
      "proposalRule": "Retain each applied Profile and owner in the preservation manifest.",
      "rationale": "The official transformation explicitly leaves ProfileApplication unmapped.",
      "testObligations": [
        "All eight applications are reconstructed with resolved Profile targets."
      ]
    },
    {
      "id": "stereotype",
      "sourceConstruct": "UML Stereotype",
      "corpusCount": 94,
      "officialTarget": "MetadataDefinition",
      "officialClauses": [
        "7.7.9.3.24-34"
      ],
      "machineRuleIds": [
        "Mappings-UML4SysML-Packages-StereotypeMetadataDefinition_Mapping",
        "Mappings-UML4SysML-Packages-StereotypeOccurenceUsage_Mapping"
      ],
      "classification": "supplement",
      "proposalRule": "Use MetadataDefinition as the primary v2 carrier and retain all source-profile facts needed for reversal.",
      "rationale": "The official target is appropriate; source extensions, icons, constraints, and XMI distinctions require preservation data.",
      "testObligations": [
        "All 94 MetadataDefinitions validate.",
        "Every Stereotype reconstructs with the same owned bases and generalizations."
      ]
    },
    {
      "id": "extension",
      "sourceConstruct": "UML Extension and ExtensionEnd",
      "corpusCount": 84,
      "officialTarget": "Handled in the Stereotype mapping context",
      "officialClauses": [
        "7.7.9.1 Table 12",
        "7.7.9.2 Table 13",
        "7.7.9.3.26-34"
      ],
      "machineRuleIds": [
        "Mappings-UML4SysML-Packages-StereotypeOccurenceUsage_Mapping",
        "Mappings-UML4SysML-Packages-StereotypeOccurenceUsageMultiplicityRange_Mapping"
      ],
      "classification": "supplement",
      "proposalRule": "Reuse official annotation-target machinery and retain exact base-property, multiplicity, name, and href facts.",
      "rationale": "The official mapping represents applicability but not every source representation detail in the round-trip contract.",
      "testObligations": [
        "All 84 Extensions and ExtensionEnds reconstruct without inferred names or multiplicities."
      ]
    },
    {
      "id": "generalization",
      "sourceConstruct": "UML Generalization",
      "corpusCount": 219,
      "officialTarget": "Subclassification",
      "officialClauses": [
        "7.7.4.2.12"
      ],
      "machineRuleIds": [
        "Mappings-UML4SysML-Classification-Generalization_Mapping"
      ],
      "classification": "supplement",
      "proposalRule": "Reuse Subclassification and retain source reference form and exact target identity.",
      "rationale": "The semantic relationship is direct, but local versus external representation is needed for exact reconstruction.",
      "testObligations": [
        "All 219 targets resolve before and after reversal.",
        "Ordered multi-parent examples remain distinguishable."
      ]
    },
    {
      "id": "library-class",
      "sourceConstruct": "Plain UML Class in a RAAML library without Block or ConstraintBlock applied",
      "corpusCount": 100,
      "officialTarget": "OccurrenceDefinition",
      "officialClauses": [
        "7.7.12.2.10"
      ],
      "machineRuleIds": [
        "Mappings-UML4SysML-StructuredClassifiers-Class_Mapping"
      ],
      "classification": "supplement",
      "proposalRule": "Reuse OccurrenceDefinition as the concrete carrier and retain the exact UML Class facts needed for reversal.",
      "rationale": "The corpus has 143 UML Classes. Seven select Block_Mapping and 36 select ConstraintBlock_Mapping, leaving 100 plain Classes for Class_Mapping. The proposal's generic Definition carrier is neither the official target nor a validated textual production.",
      "testObligations": [
        "All 100 plain library Classes emit validating occurrence definitions.",
        "Class properties, inheritance, connectors, and stereotype applications survive reversal."
      ]
    },
    {
      "id": "block",
      "sourceConstruct": "UML Class with SysML v1 Block applied",
      "corpusCount": 7,
      "officialTarget": "PartDefinition",
      "officialClauses": [
        "7.8.4.3.3"
      ],
      "machineRuleIds": [
        "Mappings-SysMLv1-Blocks-Block_Mapping"
      ],
      "classification": "supplement",
      "proposalRule": "Reuse PartDefinition and preserve the applied Block identity needed to reconstruct the source Class.",
      "rationale": "Seven FTA library Classes have Block applied. A RAAML Stereotype generalizing Block is not itself a source Class with Block applied.",
      "testObligations": [
        "All seven Block applications select PartDefinition.",
        "A focused fixture distinguishes stereotype inheritance from Block application."
      ]
    },
    {
      "id": "constraint-block",
      "sourceConstruct": "UML Class with SysML v1 ConstraintBlock applied",
      "corpusCount": 36,
      "officialTarget": "ConstraintDefinition",
      "officialClauses": [
        "7.8.5.2.1"
      ],
      "machineRuleIds": [
        "Mappings-SysMLv1-ConstraintBlocks-ConstraintBlock_Mapping"
      ],
      "classification": "supplement",
      "proposalRule": "Reuse ConstraintDefinition and preserve the source Class, applied ConstraintBlock identity, parameters, and constraints.",
      "rationale": "The corpus contains 36 ConstraintBlocks across the FTA and RBD libraries; the applied stereotype is required for exact reversal.",
      "testObligations": [
        "All 36 ConstraintBlocks select ConstraintDefinition.",
        "Constraint parameters and owned constraint expressions reconstruct under the original Class."
      ]
    },
    {
      "id": "association-block",
      "sourceConstruct": "UML AssociationClass with SysML v1 Block applied",
      "corpusCount": 1,
      "officialTarget": "ConnectionDefinition",
      "officialClauses": [
        "7.8.4.3.1"
      ],
      "machineRuleIds": [